{
  "$schema": "https://json-schema.org/draft/2020-12/schema",
  "$id": "https://signbridge.example/contracts/contest-evidence.schema.json",
  "title": "SignBridge Contest Evidence Ledger",
  "description": "Privacy-minimized claim records. evidence_linked means only that a public-safe evidence reference exists; it does not verify the claim.",
  "type": "object",
  "additionalProperties": false,
  "required": [
    "schemaVersion",
    "ledgerId",
    "generatedAt",
    "entrant",
    "records",
    "privacy"
  ],
  "properties": {
    "schemaVersion": {
      "const": "1.0.0"
    },
    "ledgerId": {
      "type": "string",
      "pattern": "^evidence_[a-z0-9]{12,64}$"
    },
    "generatedAt": {
      "type": "string",
      "format": "date-time",
      "pattern": "^[0-9]{4}-[0-9]{2}-[0-9]{2}T[0-9]{2}:[0-9]{2}:[0-9]{2}(?:\\.[0-9]{3})?Z$"
    },
    "entrant": {
      "type": "object",
      "additionalProperties": false,
      "required": ["type", "entrantRef"],
      "properties": {
        "type": {
          "enum": ["individual", "team", "organization"]
        },
        "entrantRef": {
          "type": "string",
          "pattern": "^entrant_[a-z0-9]{12,64}$"
        }
      }
    },
    "records": {
      "type": "array",
      "items": {
        "$ref": "#/$defs/record"
      }
    },
    "privacy": {
      "type": "object",
      "additionalProperties": false,
      "required": [
        "containsPersonalData",
        "containsTranscript",
        "containsPaymentDetails"
      ],
      "properties": {
        "containsPersonalData": {
          "const": false
        },
        "containsTranscript": {
          "const": false
        },
        "containsPaymentDetails": {
          "const": false
        }
      }
    }
  },
  "$defs": {
    "hash": {
      "type": "string",
      "pattern": "^sha256:[0-9a-f]{64}$"
    },
    "record": {
      "type": "object",
      "additionalProperties": false,
      "required": [
        "evidenceId",
        "category",
        "status",
        "periodStart",
        "periodEnd",
        "sourceHash",
        "metricDefinition",
        "evidenceMethod",
        "relationship",
        "measurement"
      ],
      "properties": {
        "evidenceId": {
          "type": "string",
          "pattern": "^evd_[a-z0-9]{12,64}$"
        },
        "category": {
          "enum": [
            "education_category_relevance",
            "google_cloud_product",
            "gemini_production_call",
            "reused_work_disclosure",
            "repository_access_license",
            "demo",
            "demo_media_rights",
            "free_test_surface",
            "arms_length_revenue",
            "monthly_arms_length_revenue",
            "related_party_revenue",
            "expense",
            "marketing_spend",
            "user_count",
            "user_breakdown",
            "pilot_participant_count",
            "feedback_consent",
            "production_evidence",
            "entrant_declaration",
            "organizer_readiness",
            "refund",
            "language_accuracy",
            "synchronization",
            "offline_operation",
            "small_phone_access",
            "accessibility"
          ]
        },
        "status": {
          "description": "evidence_linked records point to privacy-safe evidence but do not assert that the claim is true.",
          "enum": ["draft", "evidence_linked", "withdrawn"]
        },
        "periodStart": {
          "type": "string",
          "format": "date-time",
          "pattern": "^[0-9]{4}-[0-9]{2}-[0-9]{2}T[0-9]{2}:[0-9]{2}:[0-9]{2}(?:\\.[0-9]{3})?Z$"
        },
        "periodEnd": {
          "type": "string",
          "format": "date-time",
          "pattern": "^[0-9]{4}-[0-9]{2}-[0-9]{2}T[0-9]{2}:[0-9]{2}:[0-9]{2}(?:\\.[0-9]{3})?Z$"
        },
        "periodMonth": {
          "type": "string",
          "pattern": "^[0-9]{4}-(?:0[1-9]|1[0-2])$"
        },
        "sourceHash": {
          "$ref": "#/$defs/hash"
        },
        "metricDefinition": {
          "type": "string",
          "minLength": 1,
          "maxLength": 500
        },
        "evidenceMethod": {
          "enum": [
            "aggregate_reconciliation",
            "platform_export",
            "runtime_log",
            "public_artifact",
            "human_declaration"
          ]
        },
        "relationship": {
          "enum": ["arms_length", "related_party", "not_applicable"]
        },
        "measurement": {
          "oneOf": [
            {
              "$ref": "#/$defs/countMeasurement"
            },
            {
              "$ref": "#/$defs/moneyMeasurement"
            },
            {
              "$ref": "#/$defs/artifactMeasurement"
            }
          ]
        },
        "consentRef": {
          "type": "string",
          "pattern": "^consent_[a-z0-9]{12,64}$"
        }
      },
      "allOf": [
        {
          "if": {
            "properties": {
              "category": {
                "const": "monthly_arms_length_revenue"
              }
            },
            "required": ["category"]
          },
          "then": {
            "required": ["periodMonth"]
          },
          "else": {
            "not": {
              "required": ["periodMonth"]
            }
          }
        }
      ]
    },
    "countMeasurement": {
      "type": "object",
      "additionalProperties": false,
      "required": ["kind", "value", "unit"],
      "properties": {
        "kind": {
          "const": "count"
        },
        "value": {
          "type": "integer",
          "minimum": 0,
          "maximum": 9007199254740991
        },
        "unit": {
          "enum": ["users", "participants", "calls"]
        }
      }
    },
    "moneyMeasurement": {
      "type": "object",
      "additionalProperties": false,
      "required": ["kind", "minorUnits", "currency"],
      "properties": {
        "kind": {
          "const": "money"
        },
        "minorUnits": {
          "type": "integer",
          "minimum": 0,
          "maximum": 9007199254740991
        },
        "currency": {
          "type": "string",
          "pattern": "^[A-Z]{3}$"
        }
      }
    },
    "artifactMeasurement": {
      "type": "object",
      "additionalProperties": false,
      "required": ["kind", "artifactHash"],
      "properties": {
        "kind": {
          "const": "artifact"
        },
        "artifactHash": {
          "$ref": "#/$defs/hash"
        }
      }
    }
  }
}
